{
  "schema_version": 1,
  "film_id": "tears_of_steel",
  "synthetic": true,
  "description": "Packaged player cue index for tears_of_steel.",
  "timeline": {
    "duration_seconds": 734.167,
    "timestamp_unit": "seconds",
    "interval_convention": "half_open",
    "fps": 24.0
  },
  "cues": [
    {
      "id": "cue_tears_of_steel_gunshot_142000_143500",
      "start": 142.0,
      "end": 143.5,
      "trigger": "gunshot",
      "score": 0.88,
      "source": "audio_event_classifier"
    },
    {
      "id": "cue_tears_of_steel_loud_spike_210000_212500",
      "start": 210.0,
      "end": 212.5,
      "trigger": "loud_spike",
      "score": 0.92,
      "source": "loudness_detector"
    },
    {
      "id": "cue_tears_of_steel_profanity_359500_361000",
      "start": 359.5,
      "end": 361.0,
      "trigger": "profanity",
      "score": 1.0,
      "source": "profanity_detector"
    },
    {
      "id": "cue_tears_of_steel_explosion_540000_545000",
      "start": 540.0,
      "end": 545.0,
      "trigger": "explosion",
      "score": 0.95,
      "source": "audio_event_classifier"
    },
    {
      "id": "cue_tears_of_steel_flashing_620000_622500",
      "start": 620.0,
      "end": 622.5,
      "trigger": "flashing",
      "score": 0.85,
      "source": "flash_detector"
    },
    {
      "id": "cue_tears_of_steel_scream_650000_652000",
      "start": 650.0,
      "end": 652.0,
      "trigger": "scream",
      "score": 0.79,
      "source": "audio_event_classifier"
    }
  ]
}
