{
  "schema_version": 1,
  "film_id": "speech_triggers_test",
  "synthetic": true,
  "description": "Packaged player cue index for speech_triggers_test.",
  "timeline": {
    "duration_seconds": 17.0,
    "timestamp_unit": "seconds",
    "interval_convention": "half_open",
    "fps": 24.0
  },
  "cues": [
    {
      "id": "cue_speech_triggers_test_profanity_001000_003500",
      "start": 1.0,
      "end": 3.5,
      "trigger": "profanity",
      "score": 1.0,
      "source": "profanity_detector"
    },
    {
      "id": "cue_speech_triggers_test_profanity_007000_012500",
      "start": 7.0,
      "end": 12.5,
      "trigger": "profanity",
      "score": 1.0,
      "source": "profanity_detector"
    }
  ]
}
