{
  "schema_version": 1,
  "film_id": "sintel_trailer",
  "synthetic": false,
  "description": "Packaged player cue index for sintel_trailer.",
  "timeline": {
    "duration_seconds": 52.21,
    "timestamp_unit": "seconds",
    "interval_convention": "half_open",
    "fps": 24.0
  },
  "cues": [
    {
      "id": "cue_sintel_trailer_loud_spike_001800_010600",
      "start": 1.8,
      "end": 10.6,
      "trigger": "loud_spike",
      "score": 0.979,
      "source": "loudness_detector"
    },
    {
      "id": "cue_sintel_trailer_loud_spike_016000_018000",
      "start": 16.0,
      "end": 18.0,
      "trigger": "loud_spike",
      "score": 0.468,
      "source": "loudness_detector"
    },
    {
      "id": "cue_sintel_trailer_loud_spike_029000_031000",
      "start": 29.0,
      "end": 31.0,
      "trigger": "loud_spike",
      "score": 0.65,
      "source": "loudness_detector"
    },
    {
      "id": "cue_sintel_trailer_loud_spike_046900_048600",
      "start": 46.9,
      "end": 48.6,
      "trigger": "loud_spike",
      "score": 0.548,
      "source": "loudness_detector"
    }
  ]
}
