{
  "schema_version": 1,
  "film_id": "sintel",
  "synthetic": true,
  "description": "Synthetic raw detector outputs for pipeline integration testing and validation. Not detected from real media.",
  "timeline": {
    "duration_seconds": 52.0,
    "timestamp_unit": "seconds",
    "interval_convention": "half_open"
  },
  "cues": [
    {
      "id": "cue_sintel_flashing_010200_011800",
      "start": 10.2,
      "end": 11.8,
      "trigger": "flashing",
      "score": 0.85,
      "source": "flash_detector"
    },
    {
      "id": "cue_sintel_loud_spike_014000_014800",
      "start": 14.0,
      "end": 14.8,
      "trigger": "loud_spike",
      "score": 0.92,
      "source": "loudness_detector"
    },
    {
      "id": "cue_sintel_gunshot_018500_020000",
      "start": 18.5,
      "end": 20.0,
      "trigger": "gunshot",
      "score": 0.78,
      "source": "audio_event_classifier"
    },
    {
      "id": "cue_sintel_explosion_022000_024500",
      "start": 22.0,
      "end": 24.5,
      "trigger": "explosion",
      "score": 0.88,
      "source": "audio_event_classifier"
    },
    {
      "id": "cue_sintel_scream_026100_027400",
      "start": 26.1,
      "end": 27.4,
      "trigger": "scream",
      "score": 0.74,
      "source": "audio_event_classifier"
    },
    {
      "id": "cue_sintel_profanity_030000_030800",
      "start": 30.0,
      "end": 30.8,
      "trigger": "profanity",
      "score": 1.0,
      "source": "profanity_detector"
    },
    {
      "id": "cue_sintel_jump_scare_045000_046200",
      "start": 45.0,
      "end": 46.2,
      "trigger": "jump_scare",
      "score": 0.79,
      "source": "jump_scare_detector"
    }
  ]
}
